{
  "schema_version": "1.1.0",
  "registry": "calibration-epochs",
  "updated": "2026-09-30",
  "notice": "Immutable calibration history of DISH222. C4 is the current reference (decision D1). Every product keeps the epoch it was produced with; historical products are never relabelled. A product re-expressed on a newer epoch is a NEW dataset with a 'rederivation' record.",
  "current_calibration_id": "C4",
  "fractional_excess_definition": {
    "value": "f = P_line / P_baseline - 1, equivalently f = 10^(x/10) - 1 for a line height of x dB above the fitted baseline",
    "evidence": "documented",
    "sources": [
      {"source_id": "src-cal-report-20260923", "locator": "section 1"},
      {"source_id": "src-legacy-dish222-v75", "locator": "V70 header comment, lines 16849-16858"}
    ]
  },
  "epochs": [
    {
      "calibration_id": "C0",
      "title": "Relative scale: line height in dB above a fitted baseline",
      "instrument_id": "dish222",
      "status": "superseded",
      "valid_period": {
        "start": null,
        "end": "2026-08-26",
        "evidence": "inferred",
        "sources": [
          {"source_id": "src-fits-products-20260826", "locator": "BUNIT 'dB' / 'HI line power above baseline (uncalibrated)'"},
          {"source_id": "src-lab-comparison-note-20260828", "locator": "section 2.4"}
        ],
        "note": "Relative dB was the operational scale until LAB-anchored conversion factors were introduced. The start is unknown. The end marks the last supplied dataset whose products are purely in dB."
      },
      "model_type": "relative_db",
      "brightness_equation": null,
      "brightness_quantity": "relative_db",
      "parameters": {},
      "method": {
        "value": "Per-spectrum baseline fit on line-free channels (V65 pipeline: bandpass self-flattening, line-free re-zeroing, beam stacking); value = peak or channel height above baseline in dB",
        "evidence": "documented",
        "sources": [
          {"source_id": "src-workbook-20260826", "locator": "sheet 'Session info', row 'Spectrum definition'"},
          {"source_id": "src-legacy-dish222-v75", "locator": "_v44_norm_resid line 13268; _v44_build_skymap lines 13594-13800"}
        ]
      },
      "implementation": [
        {
          "value": "Legacy V65/V67 stitcher inside the acquisition app",
          "evidence": "documented",
          "sources": [{"source_id": "src-legacy-dish222-v75", "locator": "lines 13594-14124"}]
        },
        {
          "value": "External processing that produced the 26 Aug CSV/XLSX/FITS files (code not supplied)",
          "evidence": "inferred",
          "sources": [{"source_id": "src-fits-products-20260826", "locator": "COMMENT 'V65/V67 pipeline'"}],
          "note": "Neither legacy application contains a FITS, CSV or XLSX writer."
        }
      ],
      "sources": [{"source_id": "src-fits-products-20260826"}, {"source_id": "src-workbook-20260826"}, {"source_id": "src-lab-comparison-note-20260828"}],
      "limitations": [
        {
          "value": "No temperature scale; values are internally consistent but relative",
          "evidence": "documented",
          "sources": [{"source_id": "src-lab-comparison-note-20260828", "locator": "section 2.4"}]
        },
        {
          "value": "About 10-20% session-to-session scale wobble",
          "evidence": "documented",
          "sources": [{"source_id": "src-lab-comparison-note-20260828", "locator": "section 2.4"}]
        },
        {
          "value": "Values depend on the persisted bandpass template and baseline choices, which were not supplied",
          "evidence": "inferred",
          "sources": [{"source_id": "src-legacy-dish222-v75", "locator": "lines 13663-13715"}],
          "note": "Phase 0 audit finding S8."
        }
      ],
      "supersedes": null,
      "superseded_by": "C1",
      "superseded_reason": {
        "value": "A LAB-anchored conversion to kelvin was introduced to compare with the LAB survey",
        "evidence": "documented",
        "sources": [{"source_id": "src-lab-comparison-note-20260828", "locator": "section 2.4"}]
      }
    },
    {
      "calibration_id": "C1",
      "title": "LAB-anchored effective system temperature (single-point anchor through the origin)",
      "instrument_id": "dish222",
      "status": "superseded",
      "valid_period": {
        "start": "2026-08-26",
        "end": "2026-09-02",
        "evidence": "inferred",
        "sources": [
          {"source_id": "src-fits-products-20260826", "locator": "COMMENT 'T_sys_eff ~ 330-480 K (LAB-anchored)'"},
          {"source_id": "src-lab-comparison-note-20260828", "locator": "table: 'Effective system temperature (LAB-anchored fit)'"},
          {"source_id": "src-yfactor-record-20260902"}
        ],
        "note": "Bounded by the first products citing the LAB-anchored factor (26 Aug FITS, dated 29 Aug; validation document of 28 Aug) and the 2 Sep Y-factor calibration (C2). Exact dates are not documented."
      },
      "model_type": "lab_anchored_tsys_eff",
      "brightness_equation": "T = T_sys_eff * (10^(x/10) - 1), x = line height in dB above baseline",
      "brightness_quantity": "brightness_temperature",
      "parameters": {
        "tsys_eff_k_min": {
          "value": 330,
          "unit": "K",
          "evidence": "documented",
          "sources": [
            {"source_id": "src-lab-comparison-note-20260828", "locator": "table and section 2.3"},
            {"source_id": "src-fits-products-20260826", "locator": "COMMENT"}
          ]
        },
        "tsys_eff_k_max": {
          "value": 480,
          "unit": "K",
          "evidence": "documented",
          "sources": [
            {"source_id": "src-lab-comparison-note-20260828", "locator": "table and section 2.3"},
            {"source_id": "src-fits-products-20260826", "locator": "COMMENT"}
          ]
        }
      },
      "method": {
        "value": "Anchor a measured dB value on the galactic plane to the LAB brightness at the same (l, b) convolved to a 3 deg beam; T_sys_eff = T_B(LAB) / (10^(dB/10) - 1). The factor bundles system temperature and beam efficiency.",
        "evidence": "documented",
        "sources": [{"source_id": "src-legacy-dish222-v75", "locator": "_v44_lab_scale_calibrate, lines 15060-15136"}]
      },
      "implementation": [
        {
          "value": "V62 'LAB scale calibration' in the acquisition app, writing a stored LAB-scale calibration file (not supplied)",
          "evidence": "inferred",
          "sources": [{"source_id": "src-legacy-dish222-v75", "locator": "lines 15060-15155"}],
          "note": "This is the only LAB-anchored method in the supplied code. That it produced the quoted 330-480 K range is inferred; the validation document also mentions an 'all-sky fit' whose code is not supplied."
        }
      ],
      "sources": [
        {"source_id": "src-lab-comparison-note-20260828"},
        {"source_id": "src-fits-products-20260826"},
        {"source_id": "src-legacy-dish222-v75", "locator": "lines 15060-15155"}
      ],
      "limitations": [
        {
          "value": "Anchored on a single bright position and forced through the origin, so an additive pedestal cannot be detected",
          "evidence": "documented",
          "sources": [{"source_id": "src-cal-report-20260923", "locator": "section 4.1"}]
        },
        {
          "value": "Varies with elevation and between sessions (330-480 K)",
          "evidence": "documented",
          "sources": [{"source_id": "src-lab-comparison-note-20260828", "locator": "table"}]
        },
        {
          "value": "Depends on the external LAB profile service",
          "evidence": "documented",
          "sources": [{"source_id": "src-legacy-dish222-v75", "locator": "_v44_lab_fetch, lines 14140-14177"}]
        }
      ],
      "supersedes": "C0",
      "superseded_by": "C2",
      "superseded_reason": {
        "value": "An independent Y-factor (wall to zenith) system-temperature measurement was introduced on 2 Sep 2026",
        "evidence": "documented",
        "sources": [{"source_id": "src-yfactor-record-20260902"}]
      }
    },
    {
      "calibration_id": "C2",
      "title": "Y-factor system temperature 179.5 K with main-beam efficiency 0.30 (2 Sep 2026)",
      "instrument_id": "dish222",
      "status": "superseded",
      "established": {
        "start": "2026-09-02T11:13:14",
        "end": "2026-09-02T11:13:14",
        "evidence": "documented",
        "sources": [{"source_id": "src-yfactor-record-20260902", "locator": "date"}],
        "note": "Timestamp as written by the software, without a time zone (local time, most likely Asia/Riyadh; the zone is inferred)."
      },
      "valid_period": {
        "start": "2026-09-02",
        "end": "2026-09-20",
        "evidence": "inferred",
        "sources": [
          {"source_id": "src-gc-products-20260902", "locator": "FITS TSYS=179.5, ETA_MB=0.3"},
          {"source_id": "src-ac-products-20260903", "locator": "FITS TSYS=179.5, ETA_MB=0.3"},
          {"source_id": "src-cal-report-20260923", "locator": "section 3.1 (new hot-load T_sys on 20 Sep)"},
          {"source_id": "src-private-project-records"}
        ],
        "note": "Used for the 1-3 Sep products; private project records indicate it was still in use for sessions on 8 and 13 Sep. Replaced by the 20 Sep hot-load measurement (C3)."
      },
      "model_type": "yfactor_tsys_eta",
      "brightness_equation": "T_A = f * T_sys ; T_B = T_A / eta = f * G with G = T_sys / eta ; pedestal assumed zero",
      "brightness_quantity": "mixed",
      "parameters": {
        "tsys_k": {
          "value": 179.5,
          "unit": "K",
          "evidence": "documented",
          "sources": [{"source_id": "src-yfactor-record-20260902", "locator": "tsys"}, {"source_id": "src-gc-products-20260902", "locator": "FITS header TSYS"}]
        },
        "eta": {
          "value": 0.3,